{
  "schema_id": "taoge://registries/r7/contract-status/v0.1",
  "schema_version": "0.1",
  "registry_id": "r7-contract-status-registry-v0.1",
  "status": "active_compiled_h1",
  "effective_from": "2026-07-14",
  "contracts": [
    {"contract_id":"r7-workflow-blueprint","active_version":"0.1","lifecycle_status":"active_compiled","superseded_by":"none","compiled_layers":["product","field","skill","schema","fixture","checker"],"implementation_batch":"R7-H1"},
    {"contract_id":"p0-agent-produced-delivery-candidate-v0.5","active_version":"0.5","lifecycle_status":"superseded_pending_recompile","superseded_by":"p0-deterministic-delivery-candidate-compiler-v0.6","compiled_layers":["product","field","skill","schema","fixture","checker"],"implementation_batch":"historical_v0.5"}
  ]
}
